{
  "schema": "urn:ai-friends:schema:agent:v1:egress-decision",
  "decision_id": "d08e9da2-b120-43f3-a475-8091021324ab",
  "request_id": "6f1d2c3b-4a59-4b8c-9d0e-1f2a3b4c5d6e",
  "trace_id": "a1b2c3d4e5f60718a1b2c3d4e5f60718",
  "decided_at": "2026-08-30T10:00:00Z",
  "actor": { "kind": "agent", "id": "agent:runner-7f3a" },
  "act": [
    { "kind": "agent", "id": "agent:runner-7f3a" },
    { "kind": "human", "id": "human:op-a1b2" }
  ],
  "origin": "ai_client",
  "destination_group": "model-provider",
  "requested": { "host": "api.model-provider.example", "port": 443, "scheme": "https" },
  "resolved_ips": ["192.0.2.41", "192.0.2.42"],
  "decision": "allow",
  "reason": { "code": "ok", "rule_id": "egress-model-provider" },
  "rule_id": "egress-model-provider",
  "policy_version": "3.4.1+a1b2c3d4e5f6",
  "pin_ips": true,
  "via_proxy": true,
  "ttl_seconds": 300,
  "byte_budget": 10485760,
  "audit_event_id": "9c4a5f6e-7d8c-4ebf-a031-4c5d6e7f8093"
}
