{
  "schema": "urn:ai-friends:schema:agent:v1:egress-decision",
  "decision_id": "d08e9da2-b120-43f3-a475-8091021324b0",
  "trace_id": "b2c3d4e5f6071829b2c3d4e5f6071829",
  "decided_at": "2026-08-30T10:40:00Z",
  "actor": { "kind": "agent", "id": "agent:browser-2c8d" },
  "origin": "browser_worker",
  "requested": { "host": "metadata.internal.example", "port": 80, "scheme": "https" },
  "resolved_ips": ["169.254.169.254"],
  "decision": "deny",
  "reason": { "code": "egress_blocked", "detail": "Адрес назначения в служебном диапазоне.", "rule_id": "egress-deny-metadata" },
  "policy_version": "3.4.1+a1b2c3d4e5f6",
  "blocked_range": "metadata",
  "via_proxy": true,
  "audit_event_id": "9c4a5f6e-7d8c-4ebf-a031-4c5d6e7f8094"
}
